{"schema":"ev4-builder-intake-authorization@1.0.0","status":"accepted","validation_profile":"personal_correctness","validator_version":"builder-inspector@1.0.0","session_id":"BSESSION-001","source_file_sha256":"aaaaaaaaaaaaaaaaaaaaaaaaaaaaaaaaaaaaaaaaaaaaaaaaaaaaaaaaaaaaaaaa","canonical_package_digest":"bbbbbbbbbbbbbbbbbbbbbbbbbbbbbbbbbbbbbbbbbbbbbbbbbbbbbbbbbbbbbbbb","builder_context_schema":"ev4-builder-context-package@1.0.0","selected_candidate_id":"CANDIDATE-001","authorization_basis":"derived_by_official_validators","builder_repository_commit":null,"blocking_diagnostics":[],"warnings":[]}
